{
  "coinDenom": "INJ",
  "minCoinDenom": "inj",
  "imgSrc": "",
  "pngSrc": "https://raw.githubusercontent.com/cosmos/chain-registry/master/injective/images/inj.png",
  "type": "IBC",
  "exponent": "18",
  "cosmosDenom": "ibc/ADF401C952ADD9EE232D52C8303B8BE17FE7953C8D420F20769AF77240BD0C58",
  "description": "The INJ token is the native governance token for the Injective chain.",
  "name": "Injective",
  "tokenRepresentation": "INJ",
  "channel": "channel-10",
  "isEnabled": true,
  "erc20Address": "0x3515F25AB7637adcF1b69F4D384ed5936B83431F",
  "ibc": {
    "sourceDenom": "inj",
    "source": "Injective"
  },
  "hideFromTestnet": false,
  "coingeckoId": "injective-protocol",
  "category": "cosmos",
  "coinSourcePrefix": "inj"
}
