{
  "coinDenom": "AXL",
  "minCoinDenom": "uaxl",
  "imgSrc": "https://raw.githubusercontent.com/cosmos/chain-registry/master/axelar/images/axl.svg",
  "pngSrc": "https://raw.githubusercontent.com/cosmos/chain-registry/master/axelar/images/axl.png",
  "type": "IBC",
  "exponent": "6",
  "cosmosDenom": "ibc/473351B37CC9D7BA7B247800EF04D255E442C4C9C93976E3631B190A8F3C5570",
  "description": "The native token of Axelar",
  "name": "Axelar",
  "tokenRepresentation": "AXL",
  "channel": "channel-21",
  "isEnabled": true,
  "erc20Address": "0x94c23eE865E3c963A56263d0ce2CBF5C6cE7ce2d",
  "ibc": {
    "sourceDenom": "uaxl",
    "source": "Axelar"
  },
  "hideFromTestnet": false,
  "coingeckoId": "axelar",
  "category": "cosmos",
  "coinSourcePrefix": "axelar"
}