{
  "coinDenom": "STRD",
  "minCoinDenom": "ustrd",
  "imgSrc": "https://raw.githubusercontent.com/cosmos/chain-registry/master/stride/images/strd.svg",
  "pngSrc": "https://raw.githubusercontent.com/cosmos/chain-registry/master/stride/images/strd.png",
  "type": "IBC",
  "exponent": "6",
  "cosmosDenom": "ibc/21C0C3E238D48E370841635ADC3322F5D3D26342679102D5865DA8A56BD9524E",
  "description": "The native token of Stride",
  "name": "Stride",
  "tokenRepresentation": "STRD",
  "channel": "channel-25",
  "isEnabled": true,
  "erc20Address": "0x8FA78CEB7F04118Ec6d06AaC37Ca854691d8e963",
  "ibc": {
    "sourceDenom": "ustrd",
    "source": "Stride"
  },
  "hideFromTestnet": false,
  "coingeckoId": "stride",
  "category": "cosmos",
  "coinSourcePrefix": "stride"
}
