{
  "coinDenom": "stOSMO",
  "minCoinDenom": "stuosmo",
  "imgSrc": "https://raw.githubusercontent.com/cosmos/chain-registry/master/stride/images/stosmo.svg",
  "pngSrc": "https://raw.githubusercontent.com/cosmos/chain-registry/master/stride/images/stosmo.png",
  "type": "IBC",
  "exponent": "6",
  "cosmosDenom": "ibc/C9364B2C453F0428D04FD40B6CF486BA138FA462FE43A116268A7B695AFCFE7F",
  "description": "Staking derivative stOSMO for staked OSMO by Stride",
  "name": "Stride Staked Osmo",
  "tokenRepresentation": "OSMO",
  "channel": "channel-25",
  "isEnabled": true,
  "erc20Address": "0xD32eB974468ed767338533842D2D4Cc90B9BAb46",
  "ibc": {
    "sourceDenom": "stuosmo",
    "source": "Stride"
  },
  "hideFromTestnet": false,
  "coingeckoId": "stride-staked-osmo",
  "category": "cosmos",
  "coinSourcePrefix": "stride"
}
